{
  "schemaVersion": "guard.extension-listing.v2",
  "extensionId": "command.pyrig",
  "tagline": "Reviews pyrig project initialization, synchronization, scratch execution, scaffolding, cache deletion, and integration removal. Covers dire\u2026",
  "summary": "Reviews pyrig project initialization, synchronization, scratch execution, scaffolding, cache deletion, and integration removal. Covers direct pyrig entrypoints and uv run pyrig, not arbitrary project CLIs, plugin commands, or other launchers. Help and version do not match operation rules; independent Guard requirements still apply. Based on pyrig 18.99.1; installed plugins and overrides can change behavior.",
  "category": "other",
  "limitations": [
    "Coverage is limited to the reviewed operations and the surrounding Guard policy.",
    "A maintainer profile is not a security certification or an official upstream endorsement."
  ],
  "contributors": [
    {
      "githubId": "101592852",
      "githubLogin": "Winipedia",
      "roles": [
        "author"
      ]
    }
  ],
  "originalContributions": [
    {
      "kind": "pull-request",
      "url": "https://github.com/hashgraph-online/hol-guard/pull/3674"
    }
  ],
  "upstream": {
    "name": "pyrig command protection",
    "url": "https://github.com/Winipedia/pyrig"
  },
  "maintainerGithubIds": [
    "101592852"
  ],
  "documentationUrl": "https://github.com/Winipedia/pyrig"
}
