{
  "schemaVersion": "guard.extension-listing.v2",
  "extensionId": "mcp.xahau-mcp",
  "tagline": "Reviews Xahau MCP tools that read public Xahau JSON-RPC endpoints or emit unsigned transactions and Hook source a user could sign or deploy\u2026",
  "summary": "Reviews Xahau MCP tools that read public Xahau JSON-RPC endpoints or emit unsigned transactions and Hook source a user could sign or deploy. Offline codec, Hook WASM analysis, and local VM tools are allowed. The server never signs, submits, or holds keys. Off until you turn it on.",
  "category": "other",
  "limitations": [
    "Coverage is limited to the reviewed operations and the surrounding Guard policy.",
    "A maintainer profile is not a security certification or an official upstream endorsement."
  ],
  "contributors": [
    {
      "githubId": "216797735",
      "githubLogin": "Hugegreencandle",
      "roles": [
        "author"
      ]
    }
  ],
  "originalContributions": [
    {
      "kind": "pull-request",
      "url": "https://github.com/hashgraph-online/hol-guard/pull/3310"
    }
  ],
  "upstream": {
    "name": "Xahau MCP",
    "url": "https://github.com/Hugegreencandle/xahau-mcp#readme"
  },
  "maintainerGithubIds": [
    "216797735"
  ],
  "documentationUrl": "https://github.com/Hugegreencandle/xahau-mcp#readme"
}
