{
  "schemaVersion": "guard.extension-listing.v2",
  "extensionId": "command.kim",
  "tagline": "Reviews kim commands that mutate the local reminder config, daemon state, or notification settings; read-only inspection stays automatic.",
  "summary": "Reviews kim commands that mutate the local reminder config, daemon state, or notification settings; read-only inspection stays automatic.",
  "category": "other",
  "limitations": [
    "Coverage is limited to the reviewed operations and the surrounding Guard policy.",
    "A maintainer profile is not a security certification or an official upstream endorsement."
  ],
  "contributors": [
    {
      "githubId": "97722446",
      "githubLogin": "pratikwayal01",
      "roles": [
        "author"
      ]
    }
  ],
  "originalContributions": [
    {
      "kind": "pull-request",
      "url": "https://github.com/hashgraph-online/hol-guard/pull/2895"
    }
  ],
  "upstream": {
    "name": "kim reminder protection",
    "url": "https://github.com/pratikwayal01/kim"
  },
  "maintainerGithubIds": [
    "97722446"
  ],
  "documentationUrl": "https://github.com/pratikwayal01/kim"
}
