{
  "schemaVersion": "guard.extension-listing.v2",
  "extensionId": "mcp.fablecut",
  "tagline": "Reviews the FableCut video-editor tools that change the user's timeline or write files: replacing or patching the project, importing media,\u2026",
  "summary": "Reviews the FableCut video-editor tools that change the user's timeline or write files: replacing or patching the project, importing media, loudness, ducking and noise reduction, reference analysis and export. Reading the project, the manual, scopes and export presets is allowed. Off until you turn it on.",
  "category": "other",
  "limitations": [
    "Coverage is limited to the reviewed operations and the surrounding Guard policy.",
    "A maintainer profile is not a security certification or an official upstream endorsement."
  ],
  "contributors": [
    {
      "githubId": "84374383",
      "githubLogin": "ronak-create",
      "roles": [
        "author"
      ]
    }
  ],
  "originalContributions": [
    {
      "kind": "pull-request",
      "url": "https://github.com/hashgraph-online/hol-guard/pull/3746"
    }
  ],
  "upstream": {
    "name": "FableCut",
    "url": "https://fablecut.space"
  },
  "maintainerGithubIds": [
    "84374383"
  ],
  "documentationUrl": "https://fablecut.space"
}
