{
  "schemaVersion": "guard.extension-listing.v2",
  "extensionId": "mcp.reaper",
  "tagline": "Reviews destructive REAPER project-editing tools: batch track deletion, template deletion, and tempo or marker clears.",
  "summary": "Reviews destructive REAPER project-editing tools: batch track deletion, track template deletion, clearing every tempo marker, and multi-step undo. Off until you turn it on.",
  "category": "other",
  "limitations": [
    "Coverage is limited to the reviewed operations and the surrounding Guard policy.",
    "A maintainer profile is not a security certification or an official upstream endorsement."
  ],
  "contributors": [
    {
      "githubId": "35842612",
      "githubLogin": "xDarkzx",
      "roles": [
        "author"
      ]
    }
  ],
  "originalContributions": [
    {
      "kind": "pull-request",
      "url": "https://github.com/hashgraph-online/hol-guard/pull/3068"
    }
  ],
  "upstream": {
    "name": "ReaperMCP",
    "url": "https://github.com/xDarkzx/Reaper-MCP"
  },
  "maintainerGithubIds": [
    "35842612"
  ],
  "documentationUrl": "https://github.com/xDarkzx/Reaper-MCP"
}
