{
  "schemaVersion": "guard.extension-listing.v2",
  "extensionId": "command.kelados",
  "tagline": "HOL Guard coverage for Kelados CLI commands that synthesize audio or start a local TTS server.",
  "summary": "Reviews kelados speak, which writes a WAV file to disk, and kelados serve, which starts a local HTTP server exposing TTS synthesis endpoints. The read-only kelados voices subcommand is not matched.",
  "category": "specialized-tools",
  "limitations": [
    "Coverage is limited to the speak and serve subcommands and the surrounding Guard policy.",
    "The kelados voices subcommand is not matched; it queries available voice IDs and Guard's default handling applies to it.",
    "Version-pinned npx/bunx invocations (e.g. npx kelados@1.0.2 speak) are covered for versions 1.0.0–1.0.2; later releases require a source update."
  ],
  "documentationUrl": "https://github.com/LovekeshAnand/Kelados",
  "tags": [
    "tts",
    "text-to-speech",
    "audio",
    "cli",
    "kokoro"
  ],
  "contributors": [
    {
      "githubId": "164208889",
      "githubLogin": "LovekeshAnand",
      "roles": [
        "author"
      ]
    }
  ],
  "originalContributions": [
    {
      "kind": "pull-request",
      "url": "https://github.com/hashgraph-online/hol-guard/pull/3749"
    }
  ],
  "upstream": {
    "name": "Kelados",
    "url": "https://github.com/LovekeshAnand/Kelados"
  }
}
