{
  "schemaVersion": "guard.extension-listing.v2",
  "extensionId": "mcp.ftp",
  "tagline": "Conservative operation knowledge compiled from a contributor inventory.",
  "summary": "Conservative operation knowledge compiled from a contributor inventory.",
  "category": "other",
  "limitations": [
    "Coverage is limited to the reviewed operations and the surrounding Guard policy.",
    "A maintainer profile is not a security certification or an official upstream endorsement."
  ],
  "contributors": [
    {
      "githubId": "7357054",
      "githubLogin": "alxspiker",
      "roles": [
        "author"
      ]
    }
  ],
  "originalContributions": [
    {
      "kind": "pull-request",
      "url": "https://github.com/hashgraph-online/hol-guard/pull/4514"
    }
  ],
  "upstream": {
    "name": "FTP MCP",
    "url": "https://github.com/alxspiker/mcp-server-ftp"
  },
  "maintainerGithubIds": [
    "7357054"
  ],
  "documentationUrl": "https://github.com/alxspiker/mcp-server-ftp"
}
