{
  "schemaVersion": "guard.extension-listing.v2",
  "extensionId": "mcp.run",
  "tagline": "Reviews and gates task execution tools for the run polyglot task runner and MCP server.",
  "summary": "Reviews and gates task execution tools for the run polyglot task runner and MCP server.",
  "category": "other",
  "limitations": [
    "Coverage is limited to the reviewed operations and the surrounding Guard policy.",
    "A maintainer profile is not a security certification or an official upstream endorsement."
  ],
  "contributors": [
    {
      "githubId": "70285461",
      "githubLogin": "nihilok",
      "roles": [
        "author"
      ]
    }
  ],
  "originalContributions": [
    {
      "kind": "pull-request",
      "url": "https://github.com/hashgraph-online/hol-guard/pull/3325"
    }
  ],
  "upstream": {
    "name": "run",
    "url": "https://runtool.dev"
  },
  "maintainerGithubIds": [
    "70285461"
  ],
  "documentationUrl": "https://runtool.dev"
}
